{
  "schema_id": "infinium.evaluation.fixture-partition-history/2.0.0",
  "schema_version": "2",
  "package_id": "S6-CANDIDATE-LIVE-VAL-v2",
  "package_version": "2.0.0",
  "partition": "validation",
  "history": [
    {
      "state": "input-frozen-before-oracle-authoring",
      "reason": "A separate input author and reviewer froze the matched answer-free contexts before oracle authorship."
    },
    {
      "state": "oracle-frozen-before-product-comparison",
      "reason": "An isolated oracle author derived expected semantics from accepted rules and frozen public input bytes without product output."
    }
  ],
  "replacement_rule": "Any product-informed change requires a materially independent replacement package, oracle, and identity before another provider comparison."
}
